symbol,ThaiCompanyName,EngCompanyName,logo
SET:SINO,บริษัท ไซโน โลจิสติกส์ คอร์ปอเรชั่น จำกัด (มหาชน),SINO LOGISTICS CORPORATION PCL,https://s3-symbol-logo.tradingview.com/sino-logistics-pcl.svg
SET:SIRI,บริษัท แสนสิริ จำกัด (มหาชน),SANSIRI CO,https://s3-symbol-logo.tradingview.com/sansiri.svg
SET:SIS,บริษัท เอสไอเอส ดิสทริบิวชั่น (ประเทศไทย) จำกัด (มหาชน),SIS DISTRIBUTION (THAILAND) PCL,https://s3-symbol-logo.tradingview.com/sis-distribution-thailand.svg
SET:SISB,บริษัท เอสไอเอสบี จำกัด (มหาชน),SISB PCL,https://s3-symbol-logo.tradingview.com/sisb-pcl.svg
SET:SITHAI,บริษัท ศรีไทยซุปเปอร์แวร์ จำกัด (มหาชน),SRITHAI SUPERWARE,https://s3-symbol-logo.tradingview.com/srithai-superware.svg
SET:SJWD,บริษัท เอสซีจี เจดับเบิ้ลยูดี โลจิสติกส์ จำกัด (มหาชน),SCGJWD LOGISTICS PCL,https://s3-symbol-logo.tradingview.com/jwd-infologistics.svg
SET:SK,บริษัท ศิรกร จำกัด (มหาชน),SIRAKORN PCL,https://s3-symbol-logo.tradingview.com/sirakorn-public-company-limited.svg
SET:SKE,บริษัท สากล เอนเนอยี จำกัด (มหาชน),SAKOL ENERGY PUBLIC COMPANY LIMITED,https://s3-symbol-logo.tradingview.com/sakol-energy-public-company-limited.svg
SET:SKN,บริษัท ส.กิจชัย เอ็นเตอร์ไพรส์ จำกัด (มหาชน),S.KIJCHAI ENTERPRISE PCL,https://s3-symbol-logo.tradingview.com/skijchai-enterprise-pcl.svg
SET:SKR,บริษัท ศิครินทร์ จำกัด (มหาชน),SIKARIN PUBLIC CO,https://s3-symbol-logo.tradingview.com/sikarin-public-company-limited.svg
SET:SKY,บริษัท สกาย ไอซีที จำกัด (มหาชน),SKY ICT PCL,https://s3-symbol-logo.tradingview.com/sky-ict-pcl.svg
SET:SLP,บริษัท สาลี่ พริ้นท์ติ้ง จำกัด (มหาชน),SALEE PRINTING PUBLIC CO LTD,https://s3-symbol-logo.tradingview.com/salee-printing-public-co-ltd.svg
SET:SM,บริษัท สตาร์ มันนี่ จำกัด (มหาชน),STAR MONEY PCL,https://s3-symbol-logo.tradingview.com/star-money-pcl.svg
SET:SMART,บริษัท สมาร์ทคอนกรีต จำกัด (มหาชน),SMART CONCRETE PCL,https://s3-symbol-logo.tradingview.com/smart-concrete-pcl.svg
SET:SMD100,บริษัท เอสเอ็มดี ไรส์ จำกัด (มหาชน),SMD RISE PCL,https://s3-symbol-logo.tradingview.com/saintmed.svg
SET:SMIT,บริษัท สหมิตรเครื่องกล จำกัด (มหาชน),SAHAMIT MACHINERY PUBLIC CO LI,https://s3-symbol-logo.tradingview.com/sahamit-machinery-public-co-li.svg
SET:SMPC,บริษัท สหมิตรถังแก๊ส จำกัด (มหาชน),SAHAMITR PRESSURE CONTAINER CO,https://s3-symbol-logo.tradingview.com/sahamitr-pressure-container-co.svg
SET:SMT,บริษัท สตาร์ส ไมโครอิเล็กทรอนิกส์ (ประเทศไทย) จำกัด (มหาชน),STARS MICROELECTRONICS (THAILAND) P,https://s3-symbol-logo.tradingview.com/stars-microelectronics.svg
SET:SNC,บริษัท เอส เอ็น ซี ฟอร์เมอร์ จำกัด (มหาชน),SNC FORMER PUBLIC CO LIMITED,https://s3-symbol-logo.tradingview.com/snc-former-public-co-limited.svg
SET:SNNP,บริษัท ศรีนานาพร มาร์เก็ตติ้ง จำกัด (มหาชน),SRINANAPORN MARKETING PCL,https://s3-symbol-logo.tradingview.com/srinanaporn-marketing.svg
SET:SNP,บริษัท เอส แอนด์ พี ซินดิเคท จำกัด (มหาชน),S & P SYNDICATE PUBLIC COMPANY LTD,https://s3-symbol-logo.tradingview.com/s-and-p-syndicate-public-company-ltd.svg
SET:SNPS,บริษัท สเปเชี่ยลตี้ เนเชอรัล โปรดักส์ จำกัด (มหาชน),SPECIALTY NATURAL PRODUCTS PCL,https://s3-symbol-logo.tradingview.com/specialty-natural-products-pcl.svg
SET:SO,บริษัท สยามราชธานี จำกัด (มหาชน),SIAMRAJATHANEE PCL,https://s3-symbol-logo.tradingview.com/siamrajathanee-pcl.svg
SET:SOLAR,บริษัท โซลาร์ตรอน จำกัด (มหาชน),SOLARTRON PUBLIC CO LTD,https://s3-symbol-logo.tradingview.com/solartron-public-co-ltd.svg
SET:SONIC,บริษัท โซนิค อินเตอร์เฟรท จำกัด (มหาชน),SONIC INTERFREIGHT PCL,https://s3-symbol-logo.tradingview.com/sonic-interfreight.svg
SET:SORKON,บริษัท ส. ขอนแก่นฟู้ดส์ จำกัด (มหาชน),S. KHONKAEN FOODS PCL,https://s3-symbol-logo.tradingview.com/s-khonkaen-foods-pcl.svg
SET:SPA,บริษัท สยามเวลเนสกรุ๊ป จำกัด (มหาชน),SIAM WELLNESS GROUP PUBLIC CO LTD,https://s3-symbol-logo.tradingview.com/siam-wellness-public-co-ltd.svg
SET:SPACK,บริษัท เอส. แพ็ค แอนด์ พริ้นท์ จำกัด (มหาชน),S PACK & PRINT,https://s3-symbol-logo.tradingview.com/s-pack-and-print.svg
SET:SPALI,บริษัท ศุภาลัย จำกัด (มหาชน),SUPALAI PUBLIC CO,https://s3-symbol-logo.tradingview.com/supalai-public-company-limited.svg
SET:SPC,บริษัท สหพัฒนพิบูล จำกัด (มหาชน),SAHA PATHANAPIBUL,https://s3-symbol-logo.tradingview.com/saha-pathanapibul-public-company-limited.svg
SET:SPCG,บริษัท เอสพีซีจี จำกัด (มหาชน),SPCG PUBLIC COMPANY LIMITED,https://s3-symbol-logo.tradingview.com/spcg-public-company-limited.svg
SET:SPG,บริษัท สยามภัณฑ์กรุ๊ป จำกัด (มหาชน),SIAM PAN GROUP,https://s3-symbol-logo.tradingview.com/siam-pan.svg
SET:SPI,บริษัท สหพัฒนาอินเตอร์โฮลดิ้ง จำกัด (มหาชน),SAHA PATHANA INTER-HLDG CO,https://s3-symbol-logo.tradingview.com/saha-pathana-inter-holding.svg
SET:SPRC,บริษัท สตาร์ ปิโตรเลียม รีไฟน์นิ่ง จำกัด (มหาชน),STAR PETROLEUM REFINING PLC,https://s3-symbol-logo.tradingview.com/star-petroleum-refining.svg
SET:SPREME,บริษัท สุพรีม ดิสทิบิวชั่น จำกัด (มหาชน),SUPREME DISTRIBUTION PUBLIC COMPANY,https://s3-symbol-logo.tradingview.com/supreme-distribution-public-company.svg
SET:SPVI,บริษัท เอส พี วี ไอ จำกัด (มหาชน),S P V I PUBLIC COMPANY LIMITED,https://s3-symbol-logo.tradingview.com/s-p-v-i.svg
SET:SQ,บริษัท สหกลอิควิปเมนท์ จำกัด (มหาชน),SAHAKOL EQUIPMENT PCL,https://s3-symbol-logo.tradingview.com/sahakol-equipment-pcl.svg
SET:SR,บริษัท สยามราช จำกัด (มหาชน),SIAMRAJ PUBLIC COMPANY LIMITED,https://s3-symbol-logo.tradingview.com/siamraj-public-company-limited.svg
SET:SRICHA,บริษัท ศรีราชาคอนสตรัคชั่น จำกัด (มหาชน),SRIRACHA CONSTRUCTION PUBLIC CO,https://s3-symbol-logo.tradingview.com/sriracha-construction-public-co.svg
SET:SRS,บริษัท สิริซอฟต์ จำกัด (มหาชน),SIRISOFT PUBLIC COMPANY LIMITED,https://s3-symbol-logo.tradingview.com/sirisoft-public-company-limited.svg
SET:SSF,บริษัท สุรพลฟู้ดส์ จำกัด (มหาชน),SURAPON FOODS PUBLIC CO,https://s3-symbol-logo.tradingview.com/surapon-foods-public-co.svg
SET:SSP,บริษัท เสริมสร้าง พาวเวอร์ คอร์ปอเรชั่น จำกัด (มหาชน),SERMSANG POWER CORPORATION PCL,https://s3-symbol-logo.tradingview.com/sermsang-power-pcl.svg
SET:SSSC,บริษัท ศูนย์บริการเหล็กสยาม จำกัด (มหาชน),SIAM STEEL SERVICE CENTRE,https://s3-symbol-logo.tradingview.com/siam-steel-service-centre.svg
SET:SST,บริษัท ทรัพย์ศรีไทย จำกัด (มหาชน),SUB SRI THAI PLC,https://s3-symbol-logo.tradingview.com/sub-sri-thai-plc.svg
SET:STA,บริษัท ศรีตรังแอโกรอินดัสทรี จำกัด (มหาชน),SRI TRANG AGRO INDUSTRY PUBLIC CO,https://s3-symbol-logo.tradingview.com/sri-trang-agro-industry.svg
SET:STANLY,บริษัท ไทยสแตนเลย์การไฟฟ้า จำกัด (มหาชน),THAI STANLEY ELECTRIC PUBLIC CO,https://s3-symbol-logo.tradingview.com/thai-stanley-electric-public-co.svg
SET:STC,บริษัท เอสทีซี คอนกรีตโปรดัคท์ จำกัด (มหาชน),STC CONCRETE PRODUCT PUB CO LTD,https://s3-symbol-logo.tradingview.com/stc-concrete-product-pub-co-ltd.svg
SET:STECH,บริษัท สยามเทคนิคคอนกรีต จำกัด (มหาชน),SIAM TECHNIC CONCRETE PCL,https://s3-symbol-logo.tradingview.com/siam-technic-concrete-pcl.svg
SET:STECON,บริษัท สเตคอน กรุ๊ป จำกัด (มหาชน),STECON GROUP PUBLIC COMPANY LIMITED,https://s3-symbol-logo.tradingview.com/stecon-public-company-limited-foreign.svg
SET:STELLA,บริษัท สเตลล่า เอ็กซ์ จำกัด (มหาชน),STELLA X PLC,https://s3-symbol-logo.tradingview.com/stella-x-plc.svg
SET:STGT,บริษัท ศรีตรังโกลฟส์ (ประเทศไทย) จำกัด (มหาชน),SRI TRANG GLOVES (THAILAND) PCL,https://s3-symbol-logo.tradingview.com/sri-trang-gloves.svg
SET:STI,บริษัท สโตนเฮ้นจ์ อินเตอร์ จำกัด (มหาชน),STONEHENGE INTER PCL,https://s3-symbol-logo.tradingview.com/stonehenge-inter-pcl.svg
SET:STOWER,บริษัท สกาย ทาวเวอร์ จำกัด (มหาชน),SKY TOWER PCL,https://s3-symbol-logo.tradingview.com/sky-tower-pcl.svg
SET:STP,บริษัท สหไทยการพิมพ์และบรรจุภัณฑ์ จำกัด (มหาชน),SAHATHAI PRINTING & PACKAGING PCL,https://s3-symbol-logo.tradingview.com/sahathai-printing-and-packaging-pcl.svg
SET:STPI,บริษัท เอสทีพี แอนด์ ไอ จำกัด (มหาชน),STP & I CO,https://s3-symbol-logo.tradingview.com/stp-and-i.svg
SET:STX,บริษัท สโตนวัน จำกัด (มหาชน),STONE ONE PUBLIC COMPANY LIMITED,https://s3-symbol-logo.tradingview.com/stone-one-public-company-limited.svg
SET:SUC,บริษัท สหยูเนี่ยน จำกัด (มหาชน),SAHA-UNION,https://s3-symbol-logo.tradingview.com/saha-union.svg
SET:SUN,บริษัท ซันสวีท จำกัด (มหาชน),SUNSWEET PCL,https://s3-symbol-logo.tradingview.com/sunsweet-public-company-limited.svg
SET:SUPER,บริษัท ซุปเปอร์ เอนเนอร์ยี คอร์เปอเรชั่น จำกัด (มหาชน),SUPER ENERGY CORPORATION PCL,https://s3-symbol-logo.tradingview.com/super-energy-corporation-public-company.svg
SET:SUPEREIF,กองทุนรวมโครงสร้างพื้นฐานโรงไฟฟ้า ซุปเปอร์ เอนเนอร์ยี,SUPER ENERGY POWER PLANT INFRSTR,https://s3-symbol-logo.tradingview.com/super-energy-power-plant-infrstr.svg
SET:SUSCO,บริษัท ซัสโก้ จำกัด (มหาชน),SUSCO PCL,https://s3-symbol-logo.tradingview.com/susco-pcl.svg
SET:SUTHA,บริษัท สุธากัญจน์ จำกัด (มหาชน),GOLDEN LIME PCL,https://s3-symbol-logo.tradingview.com/golden-lime-pcl.svg
SET:SVI,บริษัท เอสวีไอ จำกัด (มหาชน),SVI PUBLIC COMPANY LIMITED,https://s3-symbol-logo.tradingview.com/svi.svg
SET:SVOA,บริษัท เอสวีโอเอ จำกัด (มหาชน),SVOA,https://s3-symbol-logo.tradingview.com/svoa.svg
SET:SVR,บริษัท สิวารมณ์ เรียลเอสเตท จำกัด (มหาชน),SIVAROM REAL ESTATE PCL,https://s3-symbol-logo.tradingview.com/sivarom-real-estate-pcl.svg
SET:SVT,บริษัท ซันเวนดิ้ง เทคโนโลยี จำกัด (มหาชน),SUN VENDING TECHNOLOGY PCL,https://s3-symbol-logo.tradingview.com/sun-vending-technology.svg
SET:SWC,บริษัท เชอร์วู้ด คอร์ปอเรชั่น (ประเทศไทย) จำกัด (มหาชน),SHERWOOD CORP THAILAND PCL,https://s3-symbol-logo.tradingview.com/sherwood-thailand-pcl.svg
SET:SYMC,บริษัท ซิมโฟนี่ คอมมูนิเคชั่น จำกัด (มหาชน),SYMPHONY COMMUNICATION PCL,https://s3-symbol-logo.tradingview.com/symphony-communication-pcl.svg
SET:SYNEX,บริษัท ซินเน็ค (ประเทศไทย) จำกัด (มหาชน),SYNNEX (THAILAND),https://s3-symbol-logo.tradingview.com/synnex.svg
SET:SYNTEC,บริษัท ซินเท็ค คอนสตรัคชั่น จำกัด (มหาชน),SYNTEC CONSTRUCTION PUBLIC CO.LTD,https://s3-symbol-logo.tradingview.com/syntec-construction-public-coltd.svg
SET:TACC,บริษัท ที.เอ.ซี. คอนซูเมอร์ จำกัด (มหาชน),TAC CONSUMER PUBLIC COMPANY LIMITED,https://s3-symbol-logo.tradingview.com/tac-consumer-public-company-limited.svg
SET:TAE,บริษัท ไทย อะโกร เอ็นเนอร์ยี่ จำกัด (มหาชน),THAI AGRO ENERGY PUBLIC CO LTD,https://s3-symbol-logo.tradingview.com/thai-agro-energy-public-co-ltd.svg
SET:TAKUNI,บริษัท ทาคูนิ กรุ๊ป จำกัด (มหาชน),TAKUNI GROUP PUBLIC COMPANY LIMITED,https://s3-symbol-logo.tradingview.com/takuni-group-public-company-limited.svg
SET:TAN,บริษัท ธนจิรา รีเทล คอร์ปอเรชั่น จำกัด (มหาชน),TANACHIRA RETAIL CORPORATION PCL,https://s3-symbol-logo.tradingview.com/tanachira-retail-pcl.svg
SET:TASCO,บริษัท ทิปโก้แอสฟัลท์ จำกัด (มหาชน),TIPCO ASPHALT,https://s3-symbol-logo.tradingview.com/tipco-asphalt-public-company-limited.svg
SET:TATG,บริษัท ไทย ออโต ทูลส์ แอนด์ ดาย จำกัด (มหาชน),THAI AUTO TOOLS AND DIE PUBLIC COMP,https://s3-symbol-logo.tradingview.com/thai-auto-tools-and-die-public-comp.svg
SET:TBN,บริษัท ทีบีเอ็น คอร์ปอเรชั่น จำกัด (มหาชน),TBN CORPORATION PCL,https://s3-symbol-logo.tradingview.com/tbn-pcl.svg
SET:TC,บริษัท ทรอปิคอลแคนนิ่ง (ประเทศไทย) จำกัด (มหาชน),TROPICAL CANNING(THAILAND)CO,https://s3-symbol-logo.tradingview.com/tropical-canning-thailand-co.svg
SET:TCAP,บริษัท ทุนธนชาต จำกัด (มหาชน),THANACHART CAPITAL PCL,https://s3-symbol-logo.tradingview.com/thanachart-capital.svg
SET:TCC,บริษัท ไทย แคปปิตอล คอร์ปอเรชั่น จำกัด (มหาชน),THAI CAPITAL CORPORATION PUBLIC LTD,https://s3-symbol-logo.tradingview.com/thai-capital.svg
SET:TCJ,บริษัท ที.ซี.เจ.เอเซีย จำกัด (มหาชน),TCJ ASIA PUBLIC CO,https://s3-symbol-logo.tradingview.com/tcj-asia-public-co.svg
SET:TCMC,บริษัท ทีซีเอ็ม คอร์ปอเรชั่น จำกัด (มหาชน),TCM CORP PUBLIC CO LTD,https://s3-symbol-logo.tradingview.com/tcm-public-co-ltd.svg
SET:TEAM,บริษัท ทีมพรีซิชั่น จำกัด (มหาชน),TEAM PRECISION,https://s3-symbol-logo.tradingview.com/team-precision.svg
SET:TEAMG,บริษัท ทีม คอนซัลติ้ง เอนจิเนียริ่ง แอนด์ แมเนจเมนท์ จำกัด (มหาชน),TEAM CONSULTING ENG & MGT PCL,https://s3-symbol-logo.tradingview.com/team-consulting-engineering-and-management.svg
SET:TEGH,บริษัท ไทยอีสเทิร์น กรุ๊ป โฮลดิ้งส์ จำกัด (มหาชน),THAI EASTERN GROUP HOLDINGS PCL,https://s3-symbol-logo.tradingview.com/thai-eastern-pcl.svg
SET:TEKA,บริษัท ฑีฆาก่อสร้าง จำกัด (มหาชน),TEKA CONSTRUCTION PCL,https://s3-symbol-logo.tradingview.com/teka-construction-pcl.svg
SET:TERA,บริษัท เทอร์ราไบท์ พลัส จำกัด (มหาชน),TERABYTE PLUS PUBLIC COMPANY LIMITE,https://s3-symbol-logo.tradingview.com/terabyte-plus-public-company-limite.svg
SET:TFG,บริษัท ไทยฟู้ดส์ กรุ๊ป จำกัด (มหาชน),THAIFOODS GROUP PUBLIC COMPANY LTD,https://s3-symbol-logo.tradingview.com/thaifoods-group-public-company-limited.svg
SET:TFI,บริษัท ไทยฟิวเจอร์อินคอร์ปอเรชั่น จำกัด (มหาชน),THAI FUTURE INCORPORATION PCL,https://s3-symbol-logo.tradingview.com/thai-future-incorporation-pcl.svg
SET:TFM,บริษัท ไทยยูเนี่ยน ฟีดมิลล์ จำกัด (มหาชน),THAI UNION FEEDMILL PCL,https://s3-symbol-logo.tradingview.com/thai-union-feedmill-pcl.svg
SET:TFMAMA,บริษัท ไทยเพรซิเดนท์ฟูดส์ จำกัด (มหาชน),THAI PRESIDENT FOODS PCL,https://s3-symbol-logo.tradingview.com/thai-president-foods-public-company.svg
SET:TGE,บริษัท ท่าฉาง กรีน เอ็นเนอร์ยี่ จำกัด (มหาชน),THACHANG GREEN ENERGY PCL,https://s3-symbol-logo.tradingview.com/thachang-green-energy-pcl.svg
SET:TGH,บริษัท ไทยกรุ๊ป โฮลดิ้งส์ จำกัด (มหาชน),THAI GROUP HOLDINGS PCL,https://s3-symbol-logo.tradingview.com/thai-group-holdings-public-company.svg
SET:TGPRO,บริษัท ไทย-เยอรมัน โปรดักส์ จำกัด (มหาชน),THAI GERMAN PRODUCTS,https://s3-symbol-logo.tradingview.com/thai-german-products.svg
SET:TH,บริษัท ตงฮั้ว โฮลดิ้ง จำกัด (มหาชน),TONG HUA HOLDING PUBLIC CO LTD,https://s3-symbol-logo.tradingview.com/tong-hua.svg
SET:THANA,บริษัท ธนาสิริ กรุ๊ป จำกัด (มหาชน),THANASIRI GROUP PUBLIC CO LTD,https://s3-symbol-logo.tradingview.com/thanasiri-public-co-ltd.svg
SET:THANI,บริษัท ราชธานีลิสซิ่ง จำกัด (มหาชน),RATCHTHANI LEASING PCL,https://s3-symbol-logo.tradingview.com/ratchthani-leasing-public-company.svg
SET:THCOM,บริษัท ไทยคม จำกัด (มหาชน),THAICOM PUBLIC COMPANY LTD,https://s3-symbol-logo.tradingview.com/thaicom-public-company-limited.svg
SET:THE,บริษัท เดอะ สตีล จำกัด (มหาชน),STEEL PCL,https://s3-symbol-logo.tradingview.com/steel-pcl.svg
SET:THG,บริษัท ธนบุรี เฮลท์แคร์ กรุ๊ป จำกัด (มหาชน),THONBURI HEALTHCARE GROUP PCL,https://s3-symbol-logo.tradingview.com/thonburi-healthcare-group-public-company.svg
SET:THIP,บริษัท ทานตะวันอุตสาหกรรม จำกัด (มหาชน),THANTAWAN INDUSTRY,https://s3-symbol-logo.tradingview.com/thantawan-industry.svg
SET:THMUI,บริษัท ไทยมุ้ย คอร์ปอเรชั่น จำกัด (มหาชน),THAI MUI CORPORATION PCL,https://s3-symbol-logo.tradingview.com/thai-mui-pcl-non-voting.svg
SET:THRE,บริษัท ไทยรับประกันภัยต่อ จำกัด (มหาชน),THAI REINSURANCE CO,https://s3-symbol-logo.tradingview.com/thaire-life-assurance-plc-non-voting.svg
SET:THREL,บริษัท ไทยรีประกันชีวิต จำกัด (มหาชน),THAIRE LIFE ASSURANCE PLC,https://s3-symbol-logo.tradingview.com/thaire-life-assurance-plc-non-voting.svg
SET:TIDLOR,บริษัท ติดล้อ โฮลดิ้งส์ จำกัด (มหาชน),TIDLOR HOLDINGS PCL,https://s3-symbol-logo.tradingview.com/tidlor-pcl.svg
SET:TIGER,บริษัท ไทย อิงเกอร์ โฮลดิ้ง จำกัด (มหาชน),THAI ENGER HLDG PCL,https://s3-symbol-logo.tradingview.com/thai-enger-hldg-pcl-non-voting.svg
SET:TIPCO,บริษัท ทิปโก้ฟูดส์ จำกัด (มหาชน),TIPCO FOODS PUBLIC COMPANY LIMITED,https://s3-symbol-logo.tradingview.com/tipco-foods-public-company-limited-non-voting.svg
SET:TIPH,บริษัท ทิพย กรุ๊ป โฮลดิ้งส์ จำกัด (มหาชน),DHIPAYA GROUP HOLDINGS PCL,https://s3-symbol-logo.tradingview.com/dhipaya.svg
SET:TISCO,บริษัท ทิสโก้ไฟแนนเชียลกรุ๊ป จำกัด (มหาชน),TISCO FINANCIAL GROUP PUBLIC CO LTD,https://s3-symbol-logo.tradingview.com/tisco.svg
SET:TITLE,บริษัท ร่มโพธิ์ พร็อพเพอร์ตี้ จำกัด (มหาชน),RHOM BHO PROPERTY PUBLIC CO LTD,https://s3-symbol-logo.tradingview.com/rhom-bho-property-public-co-ltd-non-voting.svg
SET:TK,บริษัท ฐิติกร จำกัด (มหาชน),THITIKORN PCL,https://s3-symbol-logo.tradingview.com/thitikorn-pcl-non-voting.svg
SET:TKC,บริษัท เทิร์นคีย์ คอมมูนิเคชั่น เซอร์วิส จำกัด (มหาชน),TURNKEY COMMUNICATION SERVICES PCL,https://s3-symbol-logo.tradingview.com/turnkey-communication-services-pcl-non-voting.svg
SET:TKN,บริษัท เถ้าแก่น้อย ฟู๊ดแอนด์มาร์เก็ตติ้ง จำกัด (มหาชน),TAOKAENOI FOOD & MARKETING PCL,https://s3-symbol-logo.tradingview.com/taokaenoi-food-and-marketing.svg
SET:TKS,บริษัท ที.เค.เอส. เทคโนโลยี จำกัด (มหาชน),T.K.S. TECHNOLOGIES PUBLIC CO.LTD,https://s3-symbol-logo.tradingview.com/t-k-s-technologies.svg
SET:TKT,บริษัท ที.กรุงไทยอุตสาหกรรม จำกัด (มหาชน),T.KRUNGTHAI INDUSTRIES PUBLIC CO,https://s3-symbol-logo.tradingview.com/tkrungthai-industries-public-co-non-voting.svg
SET:TL,บริษัท เทคลีด เอ็นพีเอ็น จำกัด (มหาชน),TECHLEAD NPN PCL,https://s3-symbol-logo.tradingview.com/eternal-energy.svg
SET:TLI,บริษัท ไทยประกันชีวิต จำกัด (มหาชน),THAI LIFE INSURANCE PCL,https://s3-symbol-logo.tradingview.com/thai-life-insurance-pcl-non-voting.svg
SET:TM,บริษัท เทคโนเมดิคัล จำกัด (มหาชน),TECHNO MEDICAL PCL,https://s3-symbol-logo.tradingview.com/techno-medical-pcl-non-voting.svg
SET:TMAN,บริษัท ที.แมน ฟาร์มาซูติคอล จำกัด (มหาชน),T.MAN PHARMACEUTICAL PCL,https://s3-symbol-logo.tradingview.com/tman-pharmaceutical-pcl-non-voting.svg
SET:TMC,บริษัท ที.เอ็ม.ซี. อุตสาหกรรม จำกัด (มหาชน),T.M.C. INDUSTRIAL PCL,https://s3-symbol-logo.tradingview.com/tmc-industrial-pcl-non-voting.svg
SET:TMD,บริษัท อุตสาหกรรมถังโลหะไทย จำกัด (มหาชน),THAI METAL DRUM MANUFACTURING CO,https://s3-symbol-logo.tradingview.com/thai-metal-drum-manufacturing-co-non-voting.svg
SET:TMI,บริษัท ธีระมงคล อุตสาหกรรม จำกัด (มหาชน),TEERA-MONGKOL INDUSTRY PCL,https://s3-symbol-logo.tradingview.com/teera-mongkol-industry-pcl-non-voting.svg
SET:TMILL,บริษัท ที เอส ฟลาวมิลล์ จำกัด (มหาชน),T S FLOUR MILL PCL,https://s3-symbol-logo.tradingview.com/t-s-flour-mill-pcl-non-voting.svg
SET:TMT,บริษัท ทีเอ็มที สตีล จำกัด (มหาชน),TMT STEEL PUBLIC COMPANY LIMITED,https://s3-symbol-logo.tradingview.com/tmt-steel-public-company-limited-non-voting.svg
