symbol,ThaiCompanyName,EngCompanyName,logo
SET:2S,บริษัท 2 เอส เมทัล จำกัด (มหาชน),2S METAL PUBLIC COMPANY LIMITED,https://s3-symbol-logo.tradingview.com/2s-metal-public-company-limited-non-voting.svg
SET:24CS,บริษัท ทเวนตี้ โฟร์ คอน แอนด์ ซัพพลาย จำกัด (มหาชน),TWENTY FOUR CON & SUPPLY PCL,https://s3-symbol-logo.tradingview.com/twenty-four-con-and-supply-pcl-non-voting.svg
SET:A,บริษัท อารียา พรอพเพอร์ตี้ จำกัด (มหาชน),AREEYA PROPERTY PUBLIC CO LTD,https://s3-symbol-logo.tradingview.com/areeya-property-public-co-ltd-non-voting.svg
SET:A5,บริษัท แอสเซท ไฟว์ กรุ๊ป จำกัด (มหาชน),ASSET FIVE GROUP PCL,https://s3-symbol-logo.tradingview.com/asset-five-pcl-non-voting.svg
SET:AAI,บริษัท เอเชี่ยน อะไลอันซ์ อินเตอร์เนชั่นแนล จำกัด (มหาชน),ASIAN ALLIANCE INTERNATIONAL PCL,https://s3-symbol-logo.tradingview.com/asian-alliance-international-pcl-non-voting.svg
SET:AAV,บริษัท เอเชีย เอวิเอชั่น จำกัด (มหาชน),ASIA AVIATION PUBLIC COMPANY LTD,https://s3-symbol-logo.tradingview.com/asia-aviation-public-company-limited.svg
SET:ABM,บริษัท เอเชีย ไบโอแมส จำกัด (มหาชน),ASIA BIOMASS PCL,https://s3-symbol-logo.tradingview.com/asia-biomass.svg
SET:ACC,บริษัท แอดวานซ์ คอนเนคชั่น คอร์ปอเรชั่น จำกัด (มหาชน),ADVANCED CONNECTION CORP PCL,https://s3-symbol-logo.tradingview.com/advanced-connection-corporation.svg
SET:ACE,บริษัท แอ๊บโซลูท คลีน เอ็นเนอร์จี้ จำกัด (มหาชน),ABSOLUTE CLEAN ENERGY PUBLIC CO LTD,https://s3-symbol-logo.tradingview.com/absolute-clean-energy.svg
SET:ACG,บริษัท ออโตคอร์ป โฮลดิ้ง จำกัด (มหาชน),AUTOCORP HOLDING PCL,https://s3-symbol-logo.tradingview.com/autocorp-pcl-non-voting.svg
SET:ADB,บริษัท แอ็พพลาย ดีบี จำกัด (มหาชน),APPLIED DB PCL,https://s3-symbol-logo.tradingview.com/applied-db-pcl-non-voting.svg
SET:ADD,บริษัท แอดเทค ฮับ จำกัด (มหาชน),ADDTECH HUB PCL,https://s3-symbol-logo.tradingview.com/addtech-hub-pcl-non-voting.svg
SET:ADVANC,บริษัท แอดวานซ์ อินโฟร์ เซอร์วิส จำกัด (มหาชน),ADVANCED INFO SERVICE PUBLIC CO,https://s3-symbol-logo.tradingview.com/advanced-info-service-public-company.svg
SET:ADVICE,บริษัท แอดไวซ์ ไอที อินฟินิท จำกัด (มหาชน),ADVICE IT INFINITE PUBLIC COMPANY L,https://s3-symbol-logo.tradingview.com/advice-it-infinite-public-company-l-non-voting.svg
SET:AE,บริษัท ออลล์ เอ็นเนอร์ยี่ แอนด์ ยูทิลิตี้ จำกัด (มหาชน),ALL ENERGY & UTILITIES PUBLIC CO,https://s3-symbol-logo.tradingview.com/seven-utilities-and-power-public-company.svg
SET:AEONTS,บริษัท อิออน ธนสินทรัพย์ (ไทยแลนด์) จำกัด (มหาชน),AEON THANA SINSA(THAILAND),https://s3-symbol-logo.tradingview.com/aeon-thana-sinsap-thailand.svg
SET:AF,บริษัท ไอร่า แฟคตอริ่ง จำกัด (มหาชน),AIRA FACTORING PUBLIC COMPANY LTD,https://s3-symbol-logo.tradingview.com/aira-capital-pcl-non-voting.svg
SET:AFC,บริษัท เอเซียไฟเบอร์ จำกัด (มหาชน),ASIA FIBER CO,https://s3-symbol-logo.tradingview.com/asia-fiber-co-non-voting.svg
SET:AGE,บริษัท เอเชีย กรีน เอนเนอจี จำกัด (มหาชน),ASIA GREEN ENERGY PCL,https://s3-symbol-logo.tradingview.com/asia-green-energy-public-company-limited.svg
SET:AH,บริษัท อาปิโก ไฮเทค จำกัด (มหาชน),AAPICO HITECH PUBLIC CO LTD,https://s3-symbol-logo.tradingview.com/aapico-hitech.svg
SET:AHC,บริษัท โรงพยาบาลเอกชล จำกัด (มหาชน),AIKCHOL HOSPITAL PUBLIC COMPANY LTD,https://s3-symbol-logo.tradingview.com/aikchol-hospital-public-company-ltd-non-voting.svg
SET:AI,บริษัท เอเชียน อินซูเลเตอร์ จำกัด (มหาชน),ASIAN INSULATORS PUBLIC CO LTD,https://s3-symbol-logo.tradingview.com/asian-insulators-public-co-ltd-non-voting.svg
SET:AIE,บริษัท เอไอ เอนเนอร์จี จำกัด (มหาชน),AI ENERGY PUBLIC COMPANY LIMITED,https://s3-symbol-logo.tradingview.com/ai-energy.svg
SET:AIRA,บริษัท ไอร่า แคปปิตอล จำกัด (มหาชน),AIRA CAPITAL PCL,https://s3-symbol-logo.tradingview.com/aira-capital-pcl-non-voting.svg
SET:AIT,บริษัท แอ็ดวานซ์ อินฟอร์เมชั่น เทคโนโลยี จำกัด (มหาชน),ADVANCED INFORMATION TECHNOLOGY PCL,https://s3-symbol-logo.tradingview.com/advanced-information-technology-pcl-non-voting.svg
SET:AJ,บริษัท เอ.เจ.พลาสท์ จำกัด (มหาชน),A.J. PLAST PCL,https://s3-symbol-logo.tradingview.com/aj-plast-pcl-non-voting.svg
SET:AJA,บริษัท เอเจ แอดวานซ์ เทคโนโลยี จำกัด (มหาชน),AJ ADVANCE TECHNOLOGY PUBLIC CO,https://s3-symbol-logo.tradingview.com/aj-advance-technology.svg
SET:AKP,บริษัท อัคคีปราการ จำกัด (มหาชน),AKKHIE PRAKARN PUBLIC COMPANY LTD,https://s3-symbol-logo.tradingview.com/akkhie-prakarn-public-company-limited.svg
SET:AKR,บริษัท เอกรัฐวิศวกรรม จำกัด (มหาชน),EKARAT ENGINEERING,https://s3-symbol-logo.tradingview.com/ekarat-engineering.svg
SET:AKS,บริษัท เอเคเอส คอร์ปอเรชั่น จำกัด (มหาชน),AKS CORPORATION PCL,https://s3-symbol-logo.tradingview.com/aks-pcl-non-voting.svg
SET:ALLA,บริษัท ออลล่า จำกัด (มหาชน),ALLA PCL,https://s3-symbol-logo.tradingview.com/alla-pcl-non-voting.svg
SET:ALPHAX,บริษัท อัลฟ่า ดิวิชั่นส์ จำกัด (มหาชน),ALPHA DIVISIONS PCL,https://s3-symbol-logo.tradingview.com/ocean-commerce.svg
SET:ALT,บริษัท เอแอลที เทเลคอม จำกัด (มหาชน),ALT TELECOM PCL,https://s3-symbol-logo.tradingview.com/alt-telecom-pcl-non-voting.svg
SET:ALUCON,บริษัท อลูคอน จำกัด (มหาชน),ALUCON PUBLIC CO,https://s3-symbol-logo.tradingview.com/alucon-public-co-non-voting.svg
SET:AMA,บริษัท อาม่า มารีน จำกัด (มหาชน),AMA MARINE PCL,https://s3-symbol-logo.tradingview.com/ama-marine-pcl-non-voting.svg
SET:AMANAH,บริษัท อะมานะฮ์ ลิสซิ่ง จำกัด (มหาชน),AMANAH LEASING PCL,https://s3-symbol-logo.tradingview.com/amanah-leasing-public-company-limited.svg
SET:AMARC,บริษัท ศูนย์ห้องปฏิบัติการและวิจัยทางการแพทย์และการเกษตรแห่งเอเซีย จำกัด (มหาชน),ASIA MEDICAL AND AGRICULTURAL LABOR,https://s3-symbol-logo.tradingview.com/asia-medical-and-agricultural-labor-non-voting.svg
SET:AMARIN,บริษัท อมรินทร์ คอร์เปอเรชั่นส์ จำกัด (มหาชน),AMARIN CORPORATIONS PCL,https://s3-symbol-logo.tradingview.com/amarin-corporations-pcl-non-voting.svg
SET:AMATA,บริษัท อมตะ คอร์ปอเรชัน จำกัด (มหาชน),AMATA CORP,https://s3-symbol-logo.tradingview.com/amata-corporation-public-company-limited.svg
SET:AMATAV,บริษัท อมตะ วีเอ็น จำกัด (มหาชน),AMATA VN PUBLIC COMPANY LIMITED,https://s3-symbol-logo.tradingview.com/amata-vn-public-company-limited-non-voting.svg
SET:AMC,บริษัท เอเซีย เมทัล จำกัด (มหาชน),ASIA METAL PUBLIC CO LTD,https://s3-symbol-logo.tradingview.com/asia-metal-public-co-ltd-non-voting.svg
SET:AMR,บริษัท เอเอ็มอาร์ เอเซีย จำกัด (มหาชน),AMR ASIA PCL,https://s3-symbol-logo.tradingview.com/amr-asia-pcl-non-voting.svg
SET:ANAN,บริษัท อนันดา ดีเวลลอปเม้นท์ จำกัด (มหาชน),ANANDA DEVELOPMENT PCL,https://s3-symbol-logo.tradingview.com/ananda.svg
SET:ANI,บริษัท เอเชีย เน็ตเวิร์ค อินเตอร์เนชั่นแนล จำกัด (มหาชน),ASIA NETWORK INTERNATIONAL PCL,https://s3-symbol-logo.tradingview.com/asia-network-international-pcl-non-voting.svg
SET:AOT,บริษัท ท่าอากาศยานไทย จำกัด (มหาชน),AIRPORTS OF THAILAND PUBLIC CO,https://s3-symbol-logo.tradingview.com/airports-of-thailand.svg
SET:AP,บริษัท เอพี (ไทยแลนด์) จำกัด (มหาชน),AP (THAILAND) PUBLIC COMPANY LTD,https://s3-symbol-logo.tradingview.com/ap-thailand-public-company-limited.svg
SET:APCO,บริษัท เอเชียน ไฟย์โตซูติคอลส์ จำกัด (มหาชน),ASIAN PHYTOCEUTICALS PCL,https://s3-symbol-logo.tradingview.com/asian-phytoceuticals-pcl-non-voting.svg
SET:APCS,บริษัท เอเซีย พรีซิชั่น จำกัด (มหาชน),ASIA PRECISION PUBLIC COMPANY LTD,https://s3-symbol-logo.tradingview.com/asia-precision-public-company-ltd-non-voting.svg
SET:APO,บริษัท เอเชียนน้ำมันปาล์ม จำกัด (มหาชน),ASIAN PALM OIL PLC,https://s3-symbol-logo.tradingview.com/asian-palm-oil-plc-non-voting.svg
SET:APP,บริษัท แอพพลิแคด จำกัด (มหาชน),APPLICAD PCL,https://s3-symbol-logo.tradingview.com/applicad-pcl-non-voting.svg
SET:APURE,บริษัท อกริเพียว โฮลดิ้งส์ จำกัด (มหาชน),AGRIPURE HOLDINGS PCL,https://s3-symbol-logo.tradingview.com/agripure-holdings-public-company-limited.svg
SET:AQUA,บริษัท อควา คอร์เปอเรชั่น จำกัด (มหาชน),AQUA CORPORATION PCL,https://s3-symbol-logo.tradingview.com/aqua-corporation.svg
SET:ARIN,บริษัท อรินสิริ แลนด์ จำกัด (มหาชน),ARINSIRI LAND PCL,https://s3-symbol-logo.tradingview.com/arinsiri-land-pcl-non-voting.svg
SET:ARIP,บริษัท เออาร์ไอพี จำกัด (มหาชน),ARIP PUBLIC COMPANY LIMITED,https://s3-symbol-logo.tradingview.com/arip-public-company-limited-non-voting.svg
SET:ARROW,บริษัท แอร์โรว์ ซินดิเคท จำกัด (มหาชน),ARROW SYNDICATE PUBLIC CO LTD,https://s3-symbol-logo.tradingview.com/arrow-syndicate-public-co-ltd-non-voting.svg
SET:AS,บริษัท แอสเฟียร์ อินโนเวชั่นส์ จำกัด (มหาชน),ASPHERE INNOVATIONS PCL,https://s3-symbol-logo.tradingview.com/asiasoft-corporation-public-company.svg
SET:ASAP,บริษัท ซินเนอร์เจติค ออโต้ เพอร์ฟอร์มานซ์ จำกัด (มหาชน),SYNERGETIC AUTO PERFORMANCE PCL,https://s3-symbol-logo.tradingview.com/synergetic-auto-performance-pcl-non-voting.svg
SET:ASEFA,บริษัท อาซีฟา จำกัด (มหาชน),ASEFA PUBLIC CO LTD,https://s3-symbol-logo.tradingview.com/asefa-public-co-ltd-non-voting.svg
SET:ASIA,บริษัท เอเชียโฮเต็ล จำกัด (มหาชน),ASIA HOTEL CO,https://s3-symbol-logo.tradingview.com/asia-hotel-co-non-voting.svg
SET:ASIAN,บริษัท เอเชี่ยนซี คอร์ปอเรชั่น จำกัด (มหาชน),ASIAN SEA CORP PCL,https://s3-symbol-logo.tradingview.com/asian-sea-corporation-public-company.svg
SET:ASIMAR,บริษัท เอเชียน มารีน เซอร์วิสส์ จำกัด (มหาชน),ASIAN MARINE SERVICES PUBLIC CO,https://s3-symbol-logo.tradingview.com/asian-marine-services-public-co-non-voting.svg
SET:ASK,บริษัท เอเซียเสริมกิจลีสซิ่ง จำกัด (มหาชน),ASIA SERMKIJ LEASING PCL,https://s3-symbol-logo.tradingview.com/asia-sermkij-leasing-public-company.svg
SET:ASN,บริษัท เอเอสเอ็น โบรกเกอร์ จำกัด (มหาชน),ASN BROKER PUBLIC COMPANY LTD,https://s3-symbol-logo.tradingview.com/asn-broker-public-company-ltd-non-voting.svg
SET:ASP,บริษัท เอเซีย พลัส กรุ๊ป โฮลดิ้งส์ จำกัด (มหาชน),ASIA PLUS GROUP HLDGS PCL,https://s3-symbol-logo.tradingview.com/asia-plus-public-company-ltd.svg
SET:ASW,บริษัท แอสเซทไวส์ จำกัด (มหาชน),ASSETWISE PCL,https://s3-symbol-logo.tradingview.com/assetwise-pcl-non-voting.svg
SET:ATP30,บริษัท เอทีพี 30 จำกัด (มหาชน),ATP30 PUBLIC CO LTD,https://s3-symbol-logo.tradingview.com/atp30.svg
SET:AU,บริษัท อาฟเตอร์ ยู จำกัด (มหาชน),AFTER YOU PCL,https://s3-symbol-logo.tradingview.com/after-you-pcl-non-voting.svg
SET:AUCT,บริษัท สหการประมูล จำกัด (มหาชน),UNION AUCTION PUBLIC CO LTD,https://s3-symbol-logo.tradingview.com/union-auction.svg
SET:AURA,บริษัท ออโรร่า ดีไซน์ จำกัด (มหาชน),AURORA DESIGN PCL,https://s3-symbol-logo.tradingview.com/aurora-design-pcl-non-voting.svg
SET:AWC,บริษัท แอสเสท เวิรด์ คอร์ป จำกัด (มหาชน),ASSET WORLD CORP PCL,https://s3-symbol-logo.tradingview.com/asset-world-corp-public-company-limited.svg
SET:AYUD,บริษัท อลิอันซ์ อยุธยา แคปปิตอล จำกัด (มหาชน),ALLIANZ AYUDHYA CAPITAL PCL,https://s3-symbol-logo.tradingview.com/allianz-ayudhya-capital-public-company.svg
SET:B,บริษัท บี จิสติกส์ จำกัด (มหาชน),BEGISTICS PCL,https://s3-symbol-logo.tradingview.com/begistics.svg
SET:B52,บริษัท บี-52 แคปปิตอล จำกัด (มหาชน),B-52 CAPITAL PCL,https://s3-symbol-logo.tradingview.com/b-52-capital-pcl-non-voting.svg
SET:BA,บริษัท การบินกรุงเทพ จำกัด (มหาชน),BANGKOK AIRWAYS PUBLIC CO LTD,https://s3-symbol-logo.tradingview.com/bangkok-airways-public-company-limited.svg
SET:BAFS,บริษัท บริการเชื้อเพลิงการบินกรุงเทพ จำกัด (มหาชน),BANGKOK AVIATION FUEL SERVICE,https://s3-symbol-logo.tradingview.com/bangkok-aviation-fuel-services.svg
SET:BAM,บริษัทบริหารสินทรัพย์ กรุงเทพพาณิชย์ จำกัด (มหาชน),BANGKOK COMMERCIAL ASSET MGT PCL,https://s3-symbol-logo.tradingview.com/bangkok-commercial-asset-management.svg
SET:BANPU,บริษัท บ้านปู จำกัด (มหาชน),BANPU PUBLIC COMPANY LIMITED,https://s3-symbol-logo.tradingview.com/banpu.svg
SET:BAY,ธนาคารกรุงศรีอยุธยา จำกัด (มหาชน),BANK OF AYUDHYA PUBLIC COMPANY LTD,https://s3-symbol-logo.tradingview.com/bank-of-ayudhya-public-company-limited.svg
SET:BBGI,บริษัท บีบีจีไอ จำกัด (มหาชน),BBGI PUBLIC COMPANY LIMITED,https://s3-symbol-logo.tradingview.com/bbgi-public-company-limited-non-voting.svg
SET:BBIK,บริษัท บลูบิค กรุ๊ป จำกัด (มหาชน),BLUEBIK GROUP PCL,https://s3-symbol-logo.tradingview.com/bluebik-group.svg
SET:BBL,ธนาคารกรุงเทพ จำกัด (มหาชน),BANGKOK BANK PUBLIC CO,https://s3-symbol-logo.tradingview.com/bangkok-bank-public-company-limited.svg
SET:BC,บริษัท บูทิค คอร์ปอเรชั่น จำกัด (มหาชน),BOUTIQUE CORPORATION PCL,https://s3-symbol-logo.tradingview.com/boutique-pcl-non-voting.svg
SET:BCH,บริษัท บางกอก เชน ฮอสปิทอล จำกัด (มหาชน),BANGKOK CHAIN HOSPITAL PUB CO,https://s3-symbol-logo.tradingview.com/bangkok-chain-hospital.svg
SET:BCP,บริษัท บางจาก คอร์ปอเรชั่น จำกัด (มหาชน),BANGCHAK CORPORATION PCL,https://s3-symbol-logo.tradingview.com/bangchak-corporation-public-company.svg
SET:BCPG,บริษัท บีซีพีจี จำกัด (มหาชน),BCPG PCL,https://s3-symbol-logo.tradingview.com/bcpg.svg
SET:BCT,บริษัท เบอร์ล่า คาร์บอน (ไทยแลนด์) จำกัด (มหาชน),BIRLA CARBON (THAILAND) PCL,https://s3-symbol-logo.tradingview.com/birla-carbon-thailand-public-company.svg
SET:BDMS,บริษัท กรุงเทพดุสิตเวชการ จำกัด(มหาชน),BANGKOK DUSIT MEDICAL SERVICES,https://s3-symbol-logo.tradingview.com/bangkok-dusit-medical-services.svg
SET:BE8,บริษัท เบริล 8 พลัส จำกัด (มหาชน),BERYL 8 PLUS PCL,https://s3-symbol-logo.tradingview.com/beryl-8-plus.svg
SET:BEAUTY,บริษัท บิวตี้ คอมมูนิตี้ จำกัด (มหาชน),BEAUTY COMMUNITY PUBLIC CO LTD,https://s3-symbol-logo.tradingview.com/beauty-community-public-company-limited.svg
SET:BEC,บริษัท บีอีซี เวิลด์ จำกัด (มหาชน),BEC WORLD,https://s3-symbol-logo.tradingview.com/bec-world.svg
SET:BEM,บริษัท ทางด่วนและรถไฟฟ้ากรุงเทพ จำกัด (มหาชน),BANGKOK EXPRESSWAY AND METRO PCL,https://s3-symbol-logo.tradingview.com/bangkok-expressway-and-metro.svg
SET:BEYOND,บริษัท เบาด์ แอนด์ บียอนด์ จำกัด (มหาชน),BOUND AND BEYOND PCL,https://s3-symbol-logo.tradingview.com/bound-and-beyond-pcl-non-voting.svg
SET:BGC,บริษัท บีจี คอนเทนเนอร์ กล๊าส จำกัด (มหาชน),BG CONTAINER GLASS PLC,https://s3-symbol-logo.tradingview.com/bg-container-glass-plc-non-voting.svg
SET:BGRIM,บริษัท บี.กริม เพาเวอร์ จำกัด (มหาชน),BGRIMM POWER PCL,https://s3-symbol-logo.tradingview.com/b-grimm-power.svg
SET:BGT,บริษัท บีจีที คอร์ปอเรชั่น จำกัด (มหาชน),BGT CORP PUBLIC CO LTD,https://s3-symbol-logo.tradingview.com/bgt-public-co-ltd-non-voting.svg
SET:BH,บริษัท โรงพยาบาลบำรุงราษฎร์ จำกัด (มหาชน),BUMRUNGRAD HOSPITAL CO,https://s3-symbol-logo.tradingview.com/bumrungrad-hospital.svg
SET:BIG,บริษัท บิ๊ก คาเมร่า คอร์ปอเรชั่น จำกัด (มหาชน),BIG CAMERA CORP,https://s3-symbol-logo.tradingview.com/big-camera.svg
SET:BIOTEC,บริษัท ไบโอ กรีน เอ็นเนอร์ยี่ เทค จำกัด (มหาชน),BIO GREEN ENERGY TECH PCL,https://s3-symbol-logo.tradingview.com/bio-green-energy-tech-pcl-non-voting.svg
SET:BIS,บริษัท ไบโอซายน์ แอนิมัล เฮลธ์ จำกัด (มหาชน),BIOSCIENCE ANIMAL HEALTH PCL,https://s3-symbol-logo.tradingview.com/bioscience-animal-health-pcl-non-voting.svg
SET:BIZ,บริษัท บิสซิเนสอะไลเม้นท์ จำกัด (มหาชน),BUSINESS ALIGNMENT PCL,https://s3-symbol-logo.tradingview.com/business-alignment-pcl-non-voting.svg
SET:BJC,บริษัท เบอร์ลี่ ยุคเกอร์ จำกัด (มหาชน),BERLI JUCKER PCL,https://s3-symbol-logo.tradingview.com/berli-jucker.svg
SET:BJCHI,บริษัท บีเจซี เฮฟวี่ อินดัสทรี จำกัด (มหาชน),BJC HEAVY INDUSTRIES PCL,https://s3-symbol-logo.tradingview.com/bjc-heavy-industries-pcl-non-voting.svg
SET:BKA,บริษัท บางกอก แอสเซท อินเตอร์กรุ๊ป จำกัด (มหาชน),BANGKOK ASSET INTERGROUP PCL,https://s3-symbol-logo.tradingview.com/bangkok-asset-intergroup-pcl-non-voting.svg
SET:BKD,บริษัท บางกอก เดค-คอน จำกัด (มหาชน),BANGKOK DEC-CON PUBLIC COMPANY LTD,https://s3-symbol-logo.tradingview.com/bangkok-dec-con-public-company-ltd-non-voting.svg
SET:BKGI,บริษัท แบงคอกจีโนมิกส์อินโนเวชั่น จำกัด (มหาชน),BANGKOK GENOMICS INNOVATION PUBLIC,https://s3-symbol-logo.tradingview.com/bangkok-genomics-innovation-public-non-voting.svg
SET:BKIH,บริษัท บีเคไอ โฮลดิ้งส์ จำกัด (มหาชน),BKI HOLDINGS PUBLIC COMPANY LIMITED,https://s3-symbol-logo.tradingview.com/bki-public-company-limited-non-voting.svg
SET:BLA,บริษัท กรุงเทพประกันชีวิต จำกัด (มหาชน),BANGKOK LIFE ASSURANCE PUBLIC CO LT,https://s3-symbol-logo.tradingview.com/bangkok-life-assurance.svg
SET:BLAND,บริษัท บางกอกแลนด์ จำกัด (มหาชน),BANGKOK LAND PUBLIC COMPANY LIMITED,https://s3-symbol-logo.tradingview.com/bangkok-land-public-company-limited.svg
SET:BLC,บริษัท บางกอกแล็ป แอนด์ คอสเมติค จำกัด (มหาชน),BANGKOK LAB AND COSMETIC PCL,https://s3-symbol-logo.tradingview.com/bangkok-lab-and-cosmetic-pcl-non-voting.svg
SET:BLESS,บริษัท เบล็ส แอสเสท กรุ๊ป จำกัด (มหาชน),BLESS ASSET GROUP PCL,https://s3-symbol-logo.tradingview.com/bless-asset-pcl-non-voting.svg
SET:BM,บริษัท บางกอกชีทเม็ททัล จำกัด (มหาชน),BANGKOK SHEET METAL PCL,https://s3-symbol-logo.tradingview.com/bangkok-sheet-metal-pcl-non-voting.svg
SET:BOL,บริษัท บิซิเนส ออนไลน์ จำกัด (มหาชน),BUSINESS ONLINE PUBLIC CO LTD,https://s3-symbol-logo.tradingview.com/business-online-public-company-limited.svg
SET:BPP,บริษัท บ้านปู เพาเวอร์ จำกัด (มหาชน),BANPU POWER PUBLIC CO LTD,https://s3-symbol-logo.tradingview.com/banpu-power-public-company-limited.svg
SET:BPS,บริษัท บีพีเอส เทคโนโลยี จำกัด (มหาชน),BPS TECHNOLOGY PUBLIC COMPANY LIMIT,https://s3-symbol-logo.tradingview.com/bps-technology-public-company-limit-non-voting.svg
SET:BR,บริษัท บางกอกแร้นช์ จำกัด (มหาชน),BANGKOK RANCH PUBLIC CO LTD,https://s3-symbol-logo.tradingview.com/bangkok-ranch-public-co-ltd-non-voting.svg
SET:BRI,บริษัท บริทาเนีย จำกัด (มหาชน),BRITANIA PCL,https://s3-symbol-logo.tradingview.com/britania-pcl-non-voting.svg
SET:BROCK,บริษัท บ้านร็อคการ์เด้น จำกัด (มหาชน),BAAN ROCK GARDEN PCL,https://s3-symbol-logo.tradingview.com/baan-rock-garden-pcl-non-voting.svg
SET:BRR,บริษัท น้ำตาลบุรีรัมย์ จำกัด (มหาชน),BURIRAM SUGAR PUBLIC CO LTD,https://s3-symbol-logo.tradingview.com/buriram-sugar-public-co-ltd-non-voting.svg
SET:BSBM,บริษัท บางสะพานบาร์มิล จำกัด (มหาชน),BANGSAPHAN BARMILL PCL,https://s3-symbol-logo.tradingview.com/bangsaphan-barmill.svg
SET:BSM,บริษัท บิวเดอสมาร์ท จำกัด (มหาชน),BUILDERSMART PCL,https://s3-symbol-logo.tradingview.com/buildersmart-pcl-non-voting.svg
SET:BSRC,บริษัท บางจาก ศรีราชา จำกัด (มหาชน),BANGCHAK SRIRACHA PCL,https://s3-symbol-logo.tradingview.com/esso-thailand-public-company-limited.svg
SET:BTC,บริษัท บรุ๊คเคอร์ กรุ๊ป จำกัด (มหาชน),BROOKER GROUP PUBLIC CO (THE),https://s3-symbol-logo.tradingview.com/the-brooker-group.svg
