symbol,ThaiCompanyName,EngCompanyName,logo
SET:PL,บริษัท ภัทรลิสซิ่ง จำกัด (มหาชน),PHATRA LEASING PUBLIC CO,https://s3-symbol-logo.tradingview.com/phatra-leasing-public-co-non-voting.svg
SET:PLANB,บริษัท แพลน บี มีเดีย จำกัด (มหาชน),PLAN B MEDIA PCL,https://s3-symbol-logo.tradingview.com/plan-b.svg
SET:PLANET,บริษัท แพลนเน็ต คอมมิวนิเคชั่น เอเชีย จำกัด (มหาชน),PLANET COMMUNICATIONS ASIA PCL,https://s3-symbol-logo.tradingview.com/planet-communications-asia-pcl-non-voting.svg
SET:PLAT,บริษัท เดอะ แพลทินัม กรุ๊ป จำกัด (มหาชน),PLATINUM GROUP PCL,https://s3-symbol-logo.tradingview.com/platinum-pcl-non-voting.svg
SET:PLE,บริษัท เพาเวอร์ไลน์ เอ็นจิเนียริ่ง จำกัด (มหาชน),POWER LINE ENGINEERING PCL,https://s3-symbol-logo.tradingview.com/power-line-engineering-pcl-non-voting.svg
SET:PLT,บริษัท พีลาทัส มารีน จำกัด (มหาชน),PILATUS MARINE PCL,https://s3-symbol-logo.tradingview.com/pilatus-marine-pcl-non-voting.svg
SET:PLUS,บริษัท โรแยล พลัส จำกัด (มหาชน),ROYAL PLUS PCL,https://s3-symbol-logo.tradingview.com/royal-plus-pcl-non-voting.svg
SET:PM,บริษัท พรีเมียร์ มาร์เก็ตติ้ง จำกัด (มหาชน),PREMIER MARKETING PUBLIC CO LTD,https://s3-symbol-logo.tradingview.com/premier-technology-public-co-ltd-non-voting.svg
SET:PMC,บริษัท พีเอ็มซี เลเบิล แมททีเรียลส์ จำกัด (มหาชน),PMC LABEL MATERIALS PCL,https://s3-symbol-logo.tradingview.com/pmc-label-materials-pcl-non-voting.svg
SET:PMTA,บริษัท พีเอ็ม โทรีเซน เอเชีย โฮลดิ้งส์ จำกัด (มหาชน),PM THORESEN ASIA HOLDINGS PCL,https://s3-symbol-logo.tradingview.com/pm-thoresen-asia-pcl-non-voting.svg
SET:POLY,บริษัท โพลีเน็ต จำกัด (มหาชน),POLYNET PCL,https://s3-symbol-logo.tradingview.com/polynet-pcl-non-voting.svg
SET:PORT,บริษัท สหไทย เทอร์มินอล จำกัด (มหาชน),SAHATHAI TERMINAL PCL,https://s3-symbol-logo.tradingview.com/sahathai-terminal-pcl-non-voting.svg
SET:PPM,บริษัท พรพรหมเม็ททอล จำกัด (มหาชน),PORN PROM METAL PUBLIC CO LTD,https://s3-symbol-logo.tradingview.com/porn-prom-metal-public-co-ltd-non-voting.svg
SET:PPP,บริษัท พรีเมียร์ โพรดักส์ จำกัด (มหาชน),PREMIER PRODUCTS PUBLIC CO LTD,https://s3-symbol-logo.tradingview.com/premier-technology-public-co-ltd-non-voting.svg
SET:PPPM,บริษัท พีพี ไพร์ม จำกัด (มหาชน),PP PRIME PCL,https://s3-symbol-logo.tradingview.com/pp-prime-public-company-limited.svg
SET:PPS,บริษัท โปรเจค แพลนนิ่ง เซอร์วิส จำกัด (มหาชน),PROJECT PLANNING S,https://s3-symbol-logo.tradingview.com/project-planning-service.svg
SET:PQS,บริษัท พรีเมียร์ควอลิตี้สตาร์ช จำกัด (มหาชน),PREMIER QUALITY STARCH PCL,https://s3-symbol-logo.tradingview.com/premier-quality-starch-pcl-non-voting.svg
SET:PR9,บริษัท โรงพยาบาลพระรามเก้า จำกัด (มหาชน),PRARAM 9 HOSPITAL PCL,https://s3-symbol-logo.tradingview.com/praram-9-hospital-pcl-non-voting.svg
SET:PRAKIT,บริษัท ประกิต โฮลดิ้งส์ จำกัด (มหาชน),PRAKIT HOLDINGS,https://s3-symbol-logo.tradingview.com/prakit-non-voting.svg
SET:PRAPAT,บริษัท พีรพัฒน์ เทคโนโลยี จำกัด (มหาชน),PEERAPAT TECHNOLOGY PCL,https://s3-symbol-logo.tradingview.com/peerapat-technology-pcl-non-voting.svg
SET:PREB,บริษัท พรีบิลท์ จำกัด (มหาชน),PRE-BUILT PUBLIC COMPANY LIMITED,https://s3-symbol-logo.tradingview.com/pre-built-public-company-limited-non-voting.svg
SET:PRECHA,บริษัท ปรีชากรุ๊ป จำกัด (มหาชน),PREECHA GROUP CO,https://s3-symbol-logo.tradingview.com/preecha-co-non-voting.svg
SET:PRG,บริษัท พี อาร์ จี คอร์ปอเรชั่น จำกัด (มหาชน),PRG CORPORATION PCL,https://s3-symbol-logo.tradingview.com/prg-pcl-non-voting.svg
SET:PRI,บริษัท พรีโม เซอร์วิส โซลูชั่น จำกัด (มหาชน),PRIMO SERVICE SOLUTIONS PCL,https://s3-symbol-logo.tradingview.com/primo-service-solutions-pcl-non-voting.svg
SET:PRIME,บริษัท ไพร์ม โรด เพาเวอร์ จำกัด (มหาชน),PRIME ROAD POWER PUBLIC CO LTD,https://s3-symbol-logo.tradingview.com/prime-road-power-public-co-ltd-non-voting.svg
SET:PRIN,บริษัท ปริญสิริ จำกัด (มหาชน),PRINSIRI PUBLIC COMPANY LIMITED,https://s3-symbol-logo.tradingview.com/prinsiri-public-company-limited-non-voting.svg
SET:PRINC,บริษัท พริ้นซิเพิล แคปิตอล จำกัด (มหาชน),PRINCIPAL CAPITAL PUBLIC CO LTD,https://s3-symbol-logo.tradingview.com/principal-capital-public-company-limited.svg
SET:PRM,บริษัท พริมา มารีน จำกัด (มหาชน),PRIMA MARINE PCL,https://s3-symbol-logo.tradingview.com/prima-marine-public-company-limited.svg
SET:PROEN,บริษัท โปรเอ็น คอร์ป จำกัด (มหาชน),PROEN CORP PCL,https://s3-symbol-logo.tradingview.com/proen-pcl-non-voting.svg
SET:PROS,บริษัท พรอสเพอร์ เอ็นจิเนียริ่ง จำกัด (มหาชน),PROSPER ENGINEERING PCL,https://s3-symbol-logo.tradingview.com/prosper-engineering-pcl-non-voting.svg
SET:PROUD,บริษัท พราว เรียล เอสเตท จำกัด (มหาชน),PROUD REAL ESTATE PCL,https://s3-symbol-logo.tradingview.com/proud-real-estate-pcl-non-voting.svg
SET:PRTR,บริษัท พีอาร์ทีอาร์ กรุ๊ป จำกัด (มหาชน),PRTR GROUP PUBLIC COMPANY LIMITED,https://s3-symbol-logo.tradingview.com/prtr-public-company-limited-non-voting.svg
SET:PSG,บริษัท พีเอสจี คอร์ปอเรชั่น จำกัด (มหาชน),PSG CORPORATION PCL,https://s3-symbol-logo.tradingview.com/psg-pcl.svg
SET:PSH,บริษัท พฤกษา โฮลดิ้ง จำกัด (มหาชน),PRUKSA HLDGS PUBLIC COMPANY LTD,https://s3-symbol-logo.tradingview.com/pruksa-holding-public-company-limited.svg
SET:PSL,บริษัท พรีเชียส ชิพปิ้ง จำกัด (มหาชน),PRECIOUS SHIPPING,https://s3-symbol-logo.tradingview.com/precious-shipping.svg
SET:PSP,บริษัท พี.เอส.พี.สเปเชียลตี้ส์ จำกัด (มหาชน),P.S.P. SPECIALTIES PUBLIC COMPANY L,https://s3-symbol-logo.tradingview.com/psp-specialties-public-company-l-non-voting.svg
SET:PSTC,บริษัท เพาเวอร์ โซลูชั่น เทคโนโลยี จำกัด (มหาชน),POWER SOLUTION TECHNOLOGIES PCL,https://s3-symbol-logo.tradingview.com/power-solution-technologies.svg
SET:PT,บริษัท พรีเมียร์ เทคโนโลยี จำกัด (มหาชน),PREMIER TECHNOLOGY PUBLIC CO LTD,https://s3-symbol-logo.tradingview.com/premier-technology-public-co-ltd-non-voting.svg
SET:PTC,บริษัท พรีเมียร์ แทงค์ คอร์ปอเรชั่น จำกัด (มหาชน),PREMIER TANK CORPORATION PCL,https://s3-symbol-logo.tradingview.com/premier-tank-pcl-non-voting.svg
SET:PTG,บริษัท พีทีจี เอ็นเนอยี จำกัด (มหาชน),PTG ENERGY PUBLIC COMPANY LTD,https://s3-symbol-logo.tradingview.com/ptg-energy.svg
SET:PTL,บริษัท โพลีเพล็กซ์ (ประเทศไทย) จำกัด (มหาชน),POLYPLEX THAILAND,https://s3-symbol-logo.tradingview.com/polyplex-thailand-public-company.svg
SET:PTT,บริษัท ปตท. จำกัด (มหาชน),PTT PUBLIC COMPANY,https://s3-symbol-logo.tradingview.com/ptt-public-company-limited.svg
SET:PTTEP,บริษัท ปตท.สำรวจและผลิตปิโตรเลียม จำกัด (มหาชน),PTT EXPLORATION & PRODUCTION PUBLIC,https://s3-symbol-logo.tradingview.com/ptt-exploration-and-production.svg
SET:PTTGC,บริษัท พีทีที โกลบอล เคมิคอล จำกัด (มหาชน),PTT GLOBAL CHEMICAL PUBLIC CO LTD,https://s3-symbol-logo.tradingview.com/ptt-global-chemical.svg
SET:PYLON,บริษัท ไพลอน จำกัด (มหาชน),PYLON PCL,https://s3-symbol-logo.tradingview.com/pylon-pcl-non-voting.svg
SET:Q-CON,บริษัท ควอลิตี้คอนสตรัคชั่นโปรดัคส์ จำกัด (มหาชน),QUALITY CONSTRUCTION PRODUCTS,https://s3-symbol-logo.tradingview.com/quality-construction-products-non-voting.svg
SET:QH,บริษัท ควอลิตี้เฮ้าส์ จำกัด (มหาชน),QUALITY HOUSES CO,https://s3-symbol-logo.tradingview.com/quality-houses-public-company-limited.svg
SET:QLT,บริษัท ควอลลีเทค จำกัด (มหาชน),QUALITECH PUBLIC COMPANY LIMITED,https://s3-symbol-logo.tradingview.com/qualitech-public-company-limited-non-voting.svg
SET:QTC,บริษัท คิวทีซี เอนเนอร์ยี่ จำกัด (มหาชน),QTC ENERGY PUBLIC CO LTD,https://s3-symbol-logo.tradingview.com/qtc-energy-public-co-ltd-non-voting.svg
SET:QTCG,บริษัท คิวทีซีจี จำกัด (มหาชน),QTCG PCL,https://s3-symbol-logo.tradingview.com/qtcg-pcl-non-voting.svg
SET:RABBIT,บริษัท แรบบิท โฮลดิ้งส์ จำกัด (มหาชน),RABBIT HOLDINGS PCL,https://s3-symbol-logo.tradingview.com/u-city-public-company-limited.svg
SET:RAM,บริษัท โรงพยาบาลรามคำแหง จำกัด (มหาชน),RAMKAMHAENG HOSPITAL CO,https://s3-symbol-logo.tradingview.com/ramkhamhaeng-hospital-public-company.svg
SET:RATCH,บริษัท ราช กรุ๊ป จำกัด (มหาชน),RATCH GROUP PCL,https://s3-symbol-logo.tradingview.com/ratch-group-public-company-limited.svg
SET:RBF,บริษัท อาร์ แอนด์ บี ฟู้ด ซัพพลาย จำกัด (มหาชน),R&B FOOD SUPPLY PCL,https://s3-symbol-logo.tradingview.com/r-and-b-food-supply-public-company-limited.svg
SET:RCL,บริษัท อาร์ ซี แอล จำกัด (มหาชน),REGIONAL CONTAINER LINES PUBLIC CO,https://s3-symbol-logo.tradingview.com/regional-container-lines.svg
SET:READY,บริษัท เรดดี้แพลนเน็ต จำกัด (มหาชน),READYPLANET PCL,https://s3-symbol-logo.tradingview.com/readyplanet-pcl-non-voting.svg
SET:RICHY,บริษัท ริชี่ เพลซ 2002 จำกัด (มหาชน),RICHY PLACE 2002 PCL,https://s3-symbol-logo.tradingview.com/richy-place-2002-pcl-non-voting.svg
SET:RJH,บริษัท โรงพยาบาลราชธานี จำกัด (มหาชน),RAJTHANEE HOSPITAL PUBLIC CO LTD,https://s3-symbol-logo.tradingview.com/rajthanee-hospital-public-co-ltd-non-voting.svg
SET:RML,บริษัท ไรมอน แลนด์ จำกัด (มหาชน),RAIMON LAND CO,https://s3-symbol-logo.tradingview.com/raimon-land-co-non-voting.svg
SET:ROCK,บริษัท ร้อกเวิธ จำกัด (มหาชน),ROCKWORTH PUBLIC CO,https://s3-symbol-logo.tradingview.com/rockworth-public-co-non-voting.svg
SET:ROCTEC,บริษัท ร็อคเทค โกลบอล จำกัด (มหาชน),ROCTEC GLOBAL PUBLIC CO LTD,https://s3-symbol-logo.tradingview.com/master-ad.svg
SET:ROJNA,บริษัท สวนอุตสาหกรรมโรจนะ จำกัด (มหาชน),ROJANA INDUSTRIAL PARK,https://s3-symbol-logo.tradingview.com/rojana-industrial-park-public-company.svg
SET:RP,บริษัท ท่าเรือราชาเฟอร์รี่ จำกัด (มหาชน),RAJA FERRY PORT PUBLIC COMPANY LTD,https://s3-symbol-logo.tradingview.com/raja-ferry-port-public-company-ltd-non-voting.svg
SET:RPC,บริษัท อาร์พีซีจี จำกัด (มหาชน),RPCG PUBLIC CO LTD,https://s3-symbol-logo.tradingview.com/rpcg.svg
SET:RPH,บริษัท โรงพยาบาลราชพฤกษ์ จำกัด (มหาชน),RATCHAPHRUEK HOSPITAL PCL,https://s3-symbol-logo.tradingview.com/ratchaphruek-hospital-pcl-non-voting.svg
SET:RS,บริษัท อาร์เอส จำกัด (มหาชน),RS PUBLIC COMPANY,https://s3-symbol-logo.tradingview.com/rs-public-company.svg
SET:RSP,บริษัท ริช สปอร์ต จำกัด (มหาชน),RICH SPORT PCL,https://s3-symbol-logo.tradingview.com/rich-sport-pcl-non-voting.svg
SET:RT,บริษัท ไร้ท์ทันเน็ลลิ่ง จำกัด (มหาชน),RIGHT TUNNELLING PCL,https://s3-symbol-logo.tradingview.com/right-tunnelling-pcl-non-voting.svg
SET:RWI,บริษัท ระยองไวร์ อินดัสตรีส์ จำกัด (มหาชน),RAYONG WIRE INDUSTRIES PCL,https://s3-symbol-logo.tradingview.com/rayong-wire-industries-pcl-non-voting.svg
SET:S,บริษัท สิงห์ เอสเตท จำกัด (มหาชน),SINGHA ESTATE PCL,https://s3-symbol-logo.tradingview.com/singha-estate-pcl-non-voting.svg
SET:S&J,บ.เอส แอนด์ เจ อินเตอร์เนชั่นแนล เอนเตอร์ไพรส์ จำกัด (มหาชน),S & J INTERNATIONAL ENTERPRISES,https://s3-symbol-logo.tradingview.com/s-and-j-international-enterprises-non-voting.svg
SET:S11,บริษัท เอส 11 กรุ๊ป จำกัด (มหาชน),S 11 GROUP PUBLIC CO LTD,https://s3-symbol-logo.tradingview.com/s-11-public-co-ltd-non-voting.svg
SET:SA,บริษัท ไซมิส แอสเสท จำกัด (มหาชน),SIAMESE ASSET PCL,https://s3-symbol-logo.tradingview.com/siamese-asset-public-company-limited.svg
SET:SAAM,บริษัท เอสเอเอเอ็ม ดีเวลลอปเมนท์ จำกัด (มหาชน),SAAM DEVELOPMENT PCL,https://s3-symbol-logo.tradingview.com/saam-development.svg
SET:SABINA,บริษัท ซาบีน่า จำกัด (มหาชน),SABINA PUB CO LTD,https://s3-symbol-logo.tradingview.com/sabina-pub-co-ltd-non-voting.svg
SET:SAF,บริษัท เอส.เอ.เอฟ. สเปเชียล สตีล จำกัด (มหาชน),S.A.F. SPECIAL STEEL PCL,https://s3-symbol-logo.tradingview.com/saf-special-steel-pcl-non-voting.svg
SET:SAFE,บริษัท เซฟ เฟอร์ทิลิตี้ กรุ๊ป จำกัด (มหาชน),SAFE FERTILITY GROUP PCL,https://s3-symbol-logo.tradingview.com/safe-fertility-pcl-non-voting.svg
SET:SAK,บริษัท ศักดิ์สยามลิสซิ่ง จำกัด (มหาชน),SAKSIAM LEASING PCL,https://s3-symbol-logo.tradingview.com/saksiam-leasing.svg
SET:SALEE,บริษัท สาลี่อุตสาหกรรม จำกัด (มหาชน),SALEE INDUSTRY PUBLIC CO.LTD,https://s3-symbol-logo.tradingview.com/salee-industry-public-coltd-non-voting.svg
SET:SAM,บริษัท สามชัย สตีล อินดัสทรี จำกัด (มหาชน),SAMCHAI STEEL INDUSTRIES PUBLIC CO,https://s3-symbol-logo.tradingview.com/samchai-steel-industries-public-co-non-voting.svg
SET:SAMART,บริษัท สามารถคอร์ปอเรชั่น จำกัด (มหาชน),SAMART CORP,https://s3-symbol-logo.tradingview.com/samart-non-voting.svg
SET:SAMCO,บริษัท สัมมากร จำกัด (มหาชน),SAMMAKORN CO,https://s3-symbol-logo.tradingview.com/sammakorn-co-non-voting.svg
SET:SAMTEL,บริษัท สามารถเทลคอม จำกัด (มหาชน),SAMART TELCOMS,https://s3-symbol-logo.tradingview.com/samart-telcoms-non-voting.svg
SET:SANKO,บริษัท ซังโกะ ไดคาซติ้ง (ประเทศไทย) จำกัด (มหาชน),SANKO DIECASTING (THAILAND) PCL,https://s3-symbol-logo.tradingview.com/sanko-diecasting-thailand-pcl-non-voting.svg
SET:SAPPE,บริษัท เซ็ปเป้ จำกัด (มหาชน),SAPPE PUBLIC COMPANY LIMITED,https://s3-symbol-logo.tradingview.com/sappe-public-company-limited.svg
SET:SAT,บริษัท สมบูรณ์ แอ๊ดวานซ์ เทคโนโลยี จำกัด (มหาชน),SOMBOON ADVANCE TECHNOLOGY,https://s3-symbol-logo.tradingview.com/somboon-advance-technology.svg
SET:SAUCE,บริษัท ไทยเทพรส จำกัด (มหาชน),THAITHEPAROS PUBLIC COMPANY LIMITED,https://s3-symbol-logo.tradingview.com/thaitheparos-public-company-limited-non-voting.svg
SET:SAV,บริษัท สามารถ เอวิเอชั่น โซลูชั่นส์ จำกัด (มหาชน),SAMART AVIATION SOLUTIONS PCL,https://s3-symbol-logo.tradingview.com/samart-aviation-solutions-pcl-non-voting.svg
SET:SAWAD,บริษัท ศรีสวัสดิ์ คอร์ปอเรชั่น จำกัด (มหาชน),SRISAWAD CORPORATION PCL,https://s3-symbol-logo.tradingview.com/srisawad.svg
SET:SAWANG,บริษัท สว่างเอ็กซ์ปอร์ต จำกัด (มหาชน),SAWANG EXPORT CO,https://s3-symbol-logo.tradingview.com/sawang-export-co-non-voting.svg
SET:SC,บริษัท เอสซี แอสเสท คอร์ปอเรชั่น จำกัด (มหาชน),SC ASSET CORPORATION,https://s3-symbol-logo.tradingview.com/sc-asset-corporation-public-company.svg
SET:SCAP,บริษัท ศรีสวัสดิ์ แคปปิตอล 1969 จำกัด (มหาชน),SRISAWAD CAPITAL 1969 PCL,https://s3-symbol-logo.tradingview.com/srisawad-finance-public-company-limited.svg
SET:SCB,บริษัท เอสซีบี เอกซ์ จำกัด (มหาชน),SCB X PCL,https://s3-symbol-logo.tradingview.com/the-siam-commercial-bank-public-company.svg
SET:SCC,บริษัท ปูนซิเมนต์ไทย จำกัด(มหาชน),SIAM CEMENT CO,https://s3-symbol-logo.tradingview.com/the-siam-cement-public-company-limited.svg
SET:SCCC,บริษัท ปูนซีเมนต์นครหลวง จำกัด (มหาชน),SIAM CITY CEMENT PUBLIC COMPANY,https://s3-symbol-logo.tradingview.com/siam-city-cement-public-company-limited.svg
SET:SCG,บริษัท ราชพัฒนา เอ็นเนอร์ยี จำกัด (มหาชน),RATCH PATHANA ENERGY PUBLIC COMPANY,https://s3-symbol-logo.tradingview.com/ratch-pathana-energy-public-company-non-voting.svg
SET:SCGD,บริษัท เอสซีจี เดคคอร์ จำกัด (มหาชน),SCG DECOR PUBLIC COMPANY LIMITED,https://s3-symbol-logo.tradingview.com/scg-decor-public-company-limited-non-voting.svg
SET:SCGP,บริษัท เอสซีจี แพคเกจจิ้ง จำกัด (มหาชน),SCG PACKAGING PCL,https://s3-symbol-logo.tradingview.com/scg-packaging.svg
SET:SCI,บริษัท เอสซีไอ อีเลคตริค จำกัด (มหาชน),SCI ELECTRIC PUBLIC COMPANY LIMITED,https://s3-symbol-logo.tradingview.com/sci-electric-public-company-limited-non-voting.svg
SET:SCL,บริษัท เอส.ซี.แอล.มอเตอร์ พาร์ท จำกัด (มหาชน),S.C.L. MOTOR PART PCL,https://s3-symbol-logo.tradingview.com/scl-motor-part-pcl.svg
SET:SCM,บริษัท ซัคเซสมอร์ บีอิ้งค์ จำกัด (มหาชน),SUCCESSMORE BEING PCL,https://s3-symbol-logo.tradingview.com/successmore-being-pcl.svg
SET:SCN,บริษัท สแกน อินเตอร์ จำกัด (มหาชน),SCAN INTER PUBLIC CO LTD,https://s3-symbol-logo.tradingview.com/scan-inter-public-co-ltd.svg
SET:SCP,บริษัท ทักษิณคอนกรีต จำกัด (มหาชน),SOUTHERN CONCRETE PILE CO,https://s3-symbol-logo.tradingview.com/southern-concrete-pile-co.svg
SET:SDC,บริษัท สามารถ ดิจิตอล จำกัด (มหาชน),SAMART DIGITAL PCL,https://s3-symbol-logo.tradingview.com/samart-digital-public-company-limited.svg
SET:SE,บริษัท สยามอีสต์ โซลูชั่น จำกัด (มหาชน),SIAMEAST SOLUTIONS PCL,https://s3-symbol-logo.tradingview.com/siam-east-solutions.svg
SET:SE-ED,บริษัท ซีเอ็ดยูเคชั่น จำกัด (มหาชน),SE-EDUCATION,https://s3-symbol-logo.tradingview.com/se-education.svg
SET:SEAFCO,บริษัท ซีฟโก้ จำกัด (มหาชน),SEAFCO PUBLIC CO L,https://s3-symbol-logo.tradingview.com/seafco-public-co-l.svg
SET:SEAOIL,บริษัท ซีออยล์ จำกัด (มหาชน),SEA OIL PUBLIC COMPANY LIMITED,https://s3-symbol-logo.tradingview.com/sea-oil-public-company-limited.svg
SET:SECURE,บริษัท เอ็นฟอร์ซ ซีเคียว จำกัด (มหาชน),NFORCE SECURE PCL,https://s3-symbol-logo.tradingview.com/nforce-secure-pcl.svg
SET:SEI,บริษัท เอสอีไอ เมดิคัล จำกัด (มหาชน),SEI MEDICAL PCL,https://s3-symbol-logo.tradingview.com/sei-medical-pcl.svg
SET:SELIC,บริษัท ซีลิค คอร์พ จำกัด (มหาชน),SELIC CORP PCL,https://s3-symbol-logo.tradingview.com/selic-pcl.svg
SET:SENA,บริษัท เสนาดีเวลลอปเม้นท์ จำกัด (มหาชน),SENA DEVELOPMENT PUBLIC COMPANY LTD,https://s3-symbol-logo.tradingview.com/sena-development-public-company-ltd.svg
SET:SENX,บริษัท เซ็น เอกซ์ จำกัด (มหาชน),SEN X PCL,https://s3-symbol-logo.tradingview.com/sen-x-pcl.svg
SET:SFLEX,บริษัท สตาร์เฟล็กซ์ จำกัด (มหาชน),STARFLEX PCL,https://s3-symbol-logo.tradingview.com/starflex-pcl.svg
SET:SFT,บริษัท ชริ้งเฟล็กซ์ (ประเทศไทย) จำกัด (มหาชน),SHRINKFLEX (THAILAND) PCL,https://s3-symbol-logo.tradingview.com/shrinkflex-thailand-pcl.svg
SET:SGC,บริษัท เอสจี แคปปิตอล จำกัด (มหาชน),SG CAPITAL PCL,https://s3-symbol-logo.tradingview.com/sg-capital-pcl.svg
SET:SGF,บริษัท เอสจีเอฟ แคปปิตอล จำกัด (มหาชน),SGF CAPITAL PCL,https://s3-symbol-logo.tradingview.com/sgf-capital.svg
SET:SGP,บริษัท สยามแก๊ส แอนด์ ปิโตรเคมีคัลส์ จำกัด (มหาชน),SIAMGAS AND PETROCHEMICALS PUB CO,https://s3-symbol-logo.tradingview.com/siamgas-and-petrochemicals.svg
SET:SHANG,บริษัท แชงกรี-ลา โฮเต็ล จำกัด (มหาชน),SHANGRI-LA HOTEL BANGKOK,https://s3-symbol-logo.tradingview.com/shangri-la-hkd.svg
SET:SHR,บริษัท เอส โฮเทล แอนด์ รีสอร์ท จำกัด (มหาชน),S HOTELS AND RESORTS PCL,https://s3-symbol-logo.tradingview.com/s-hotels-and-resorts-public-company.svg
SET:SIAM,บริษัท สยามสตีลอินเตอร์เนชั่นแนล จำกัด (มหาชน),SIAM STEEL INTERNATIONAL,https://s3-symbol-logo.tradingview.com/siam-steel-international.svg
SET:SICT,บริษัท ซิลิคอน คราฟท์ เทคโนโลยี จำกัด (มหาชน),SILICON CRAFT TECHNOLOGY PCL,https://s3-symbol-logo.tradingview.com/silicon-craft-technology.svg
SET:SIMAT,บริษัท ไซแมท เทคโนโลยี จำกัด (มหาชน),SIMAT TECHNOLOGIES PUBLIC CO. LTD.,https://s3-symbol-logo.tradingview.com/simat-technologies-public-co-ltd.svg
SET:SINGER,บริษัท ซิงเกอร์ประเทศไทย จำกัด (มหาชน),SINGER THAILAND PCL,https://s3-symbol-logo.tradingview.com/singer.svg
